{
  "identifier": {
    "identifier": "10.1234/example-full",
    "identifierType": "DOI"
  },
  "creators": [
    {
      "creatorName": "Miller, Elizabeth",
      "nameIdentifier": {
        "nameIdentifier": "0000-0001-5000-0007",
        "nameIdentifierScheme": "ORCID",
        "schemeURI": "http://orcid.org/"
      },
      "affiliation": "DataCite"
    }
  ],
  "titles": [
    {
      "title": "Full DataCite XML Example",
      "lang": "en-us"
    },
    {
      "title": "Demonstration of DataCite Properties.",
      "titleType": "Subtitle",
      "lang": "en-us"
    }
  ],
  "publisher": "DataCite",
  "publicationYear": "2014",
  "subjects": [
    {
      "subject": "000 computer science",
      "subjectScheme": "dewey",
      "schemeURI": "http://dewey.info/",
      "lang": "en-us"
    }
  ],
  "contributors": [
    {
      "contributorName": "Starr, Joan",
      "contributorType": "ProjectLeader",
      "nameIdentifier": {
        "nameIdentifier": "0000-0002-7285-027X",
        "nameIdentifierScheme": "ORCID",
        "schemeURI": "http://orcid.org/"
      },
      "affiliation": "California Digital Library"
    }
  ],
  "dates": [
    {
      "date": "2014-10-17",
      "dateType": "Updated"
    }
  ],
  "language": "en-us",
  "resourceType": {
    "resourceTypeGeneral": "Software",
    "resourceType": "XML"
  },
  "alternateIdentifiers": [
    {
      "alternateIdentifier": "http://schema.datacite.org/schema/meta/kernel-3.1/example/datacite-example-full-v3.1.xml",
      "alternateIdentifierType": "URL"
    }
  ],
  "relatedIdentifiers": [
    {
      "relatedIdentifier": "http://data.datacite.org/application/citeproc+json/10.1234/example-full",
      "relatedIdentifierType": "URL",
      "relationType": "HasMetadata",
      "relatedMetadataScheme": "citeproc+json",
      "schemeURI": "https://github.com/citation-style-language/schema/raw/master/csl-data.json"
    },
    {
      "relatedIdentifier": "arXiv:0706.0001",
      "relatedIdentifierType": "arXiv",
      "relationType": "IsReviewedBy"
    }
  ],
  "sizes": [
    "3KB"
  ],
  "formats": [
    "application/xml"
  ],
  "version": "3.1",
  "rightsList": [
    {
      "rights": "CC0 1.0 Universal",
      "rightsURI": "http://creativecommons.org/publicdomain/zero/1.0/"
    }
  ],
  "descriptions": [
    {
      "descriptionType": "Abstract",
      "lang": "en-us",
      "description": "XML example of all DataCite Metadata Schema v3.1 properties."
    }
  ],
  "geoLocations": [
    {
      "geoLocationPoint": "31.233 -67.302",
      "geoLocationBox": "41.090 -71.032  42.893 -68.211",
      "geoLocationPlace": "Atlantic Ocean"
    }
  ]
}
